{
  "schema_version": 1,
  "target_kind": "unpromoted_death_view_subset",
  "target_name": "core-dev-death-view",
  "required_copy_ids": [
    "attack.environment.core_hazard",
    "attack.network.disconnect",
    "boss.caldus.bell_ring",
    "boss.caldus.charge_lane",
    "boss.caldus.charge_stop_ring",
    "boss.caldus.shield_arc",
    "death.action.back",
    "death.action.character_select",
    "death.action.create_successor",
    "death.action.inspect_trace",
    "death.action.load_more",
    "death.action.memorial",
    "death.action.retry",
    "death.action.successor_unavailable",
    "death.cause.damage_over_time",
    "death.cause.direct_hit",
    "death.cause.disconnect",
    "death.cause.environment",
    "death.damage_type.physical",
    "death.damage_type.veil",
    "death.echo.available",
    "death.echo.dormant",
    "death.echo.not_eligible",
    "death.error.content_mismatch",
    "death.error.corrupt_record",
    "death.error.death_not_found",
    "death.error.death_not_owned",
    "death.error.feature_disabled",
    "death.error.page_out_of_range",
    "death.error.service_unavailable",
    "death.error.title",
    "death.error.unauthenticated",
    "death.field.attack",
    "death.field.cause",
    "death.field.class",
    "death.field.damage",
    "death.field.damage_type",
    "death.field.final_deed",
    "death.field.killer",
    "death.field.level",
    "death.field.lifetime",
    "death.field.network",
    "death.field.recall",
    "death.field.source_position",
    "death.memorial.empty",
    "death.memorial.title",
    "death.network.connected",
    "death.network.degraded",
    "death.network.link_lost",
    "death.network.reattached",
    "death.recall.channeling",
    "death.recall.completion_pending",
    "death.recall.inactive",
    "death.section.created",
    "death.section.hero",
    "death.section.lost",
    "death.section.network",
    "death.section.preserved",
    "death.section.timeline",
    "death.section.what_happened",
    "death.state.awaiting_commit",
    "death.state.awaiting_commit_detail",
    "death.state.loading_memorial",
    "death.state.loading_summary",
    "death.state.loading_trace",
    "death.summary.eyebrow",
    "death.summary.title",
    "deed.core.sepulcher_knight_defeated",
    "deed.core.sir_caldus_defeated",
    "deed.none",
    "environment.core.hazard",
    "hero.core.grave_arbalist",
    "material.bell_brass",
    "material.echo_ember",
    "material.funeral_root",
    "material.saltglass_shard",
    "memorial.presentation.core_default",
    "miniboss.choir_abbot.recovery_ring",
    "miniboss.choir_abbot.rotor",
    "miniboss.sepulcher_knight.charge_lane",
    "miniboss.sepulcher_knight.shield_fan",
    "miniboss.sepulcher_knight.stop_ring",
    "network.disconnect",
    "pattern.enemy.bell_acolyte.alternating_fan",
    "pattern.enemy.bell_reed.gap_ring",
    "pattern.enemy.chain_sentry.cross_lanes",
    "pattern.enemy.choir_skull.rotor",
    "pattern.enemy.drowned_pilgrim.fan",
    "pattern.enemy.mire_leech.charge",
    "projection.created.echo",
    "projection.created.memorial",
    "projection.preserved.account_records",
    "projection.preserved.cosmetics",
    "projection.preserved.currency",
    "projection.preserved.recipes",
    "projection.preserved.vault",
    "status.bleed",
    "status.exhaustion",
    "status.frostbind",
    "status.guardbreak",
    "status.hex",
    "status.marked",
    "status.silence"
  ],
  "required_asset_ids": [
    "portrait.boss.sir_caldus",
    "portrait.miniboss.sepulcher_knight",
    "sprite.station.memorial_wall"
  ],
  "expected_records_blake3": "8189586e8583efd104b7a063f9f8752159b011ace763b78abea54c69ddcd7765",
  "expected_assets_blake3": "05b8f00f6b3f82f7176473facff3d3e0e90385ccf106d290662acc74b4b3fff9",
  "expected_localization_blake3": "a6e41565d606a6711a8ec962cf81fa7e2fae74323fb69db98fe38695872ca025"
}
